{
  "schema_version": "1.0",
  "status": "draft_for_staging",
  "editorial_standard": "ANG premium international",
  "destinations": [
    {
      "country": "Brasil",
      "currency": "Real brasileiro (BRL)",
      "languages": ["Português"],
      "voltage": "127/220 V",
      "best_time": "Abril a junho e agosto a novembro, conforme a região",
      "cities": [
        {
          "name": "Rio de Janeiro",
          "summary": "Paisagens urbanas entre montanhas, mar, patrimônio cultural e hospitalidade brasileira.",
          "attractions": ["Cristo Redentor", "Pão de Açúcar", "Jardim Botânico", "Parque Lage", "Museu do Amanhã", "Museu de Arte do Rio", "Theatro Municipal", "Praia de Ipanema"],
          "premium_experiences": ["Passeio privativo de barco pela Baía de Guanabara", "Helicóptero panorâmico", "Experiência gastronômica com chef", "Concierge para eventos e restaurantes"]
        },
        {
          "name": "São Paulo",
          "summary": "Capital cultural e gastronômica da América Latina, com hotelaria, arte, negócios e compras.",
          "attractions": ["MASP", "Pinacoteca", "Museu do Ipiranga", "Parque Ibirapuera", "Instituto Moreira Salles", "Theatro Municipal", "Mercado Municipal", "Avenida Paulista"],
          "premium_experiences": ["Roteiro privado de arte e arquitetura", "Mesa do chef", "Personal shopper", "Traslado executivo com concierge"]
        }
      ]
    },
    {
      "country": "Argentina",
      "currency": "Peso argentino (ARS)",
      "languages": ["Espanhol"],
      "voltage": "220 V",
      "best_time": "Primavera e outono",
      "cities": [
        {"name": "Buenos Aires", "summary": "Arquitetura europeia, tango, gastronomia e intensa vida cultural.", "attractions": ["Teatro Colón", "MALBA", "Museo Nacional de Bellas Artes", "Cemitério da Recoleta", "Casa Rosada", "Puerto Madero", "El Ateneo Grand Splendid", "San Telmo"], "premium_experiences": ["Tango VIP com jantar", "Tour privado de arquitetura", "Degustação de vinhos argentinos", "Experiência gastronômica em Puerto Madero"]},
        {"name": "Mendoza", "summary": "Capital argentina do vinho, aos pés da Cordilheira dos Andes.", "attractions": ["Parque General San Martín", "Museo del Área Fundacional", "Plaza Independencia", "Vinícolas de Luján de Cuyo", "Vale do Uco", "Cerro de la Gloria"], "premium_experiences": ["Visita privativa a vinícolas", "Almoço harmonizado", "Sobrevoo dos Andes", "Hospedagem em wine lodge"]}
      ]
    },
    {
      "country": "Itália",
      "currency": "Euro (EUR)",
      "languages": ["Italiano"],
      "voltage": "230 V",
      "best_time": "Abril a junho e setembro a outubro",
      "cities": [
        {"name": "Roma", "summary": "Patrimônio histórico monumental, arte, gastronomia e vida urbana italiana.", "attractions": ["Coliseu", "Fórum Romano", "Museus Vaticanos", "Basílica de São Pedro", "Panteão", "Fontana di Trevi", "Galleria Borghese", "Piazza Navona"], "premium_experiences": ["Abertura especial de monumentos", "Guia privado especializado", "Tour gastronômico", "Carro executivo com motorista"]},
        {"name": "Milão", "summary": "Moda, design, arte e negócios em uma das cidades mais sofisticadas da Europa.", "attractions": ["Duomo de Milão", "Galleria Vittorio Emanuele II", "Teatro alla Scala", "Pinacoteca di Brera", "Castello Sforzesco", "Fondazione Prada", "Quadrilatero della Moda"], "premium_experiences": ["Personal shopper", "Acesso a ateliers", "Ópera e bastidores", "Experiência de design e arquitetura"]}
      ]
    },
    {
      "country": "França",
      "currency": "Euro (EUR)",
      "languages": ["Francês"],
      "voltage": "230 V",
      "best_time": "Abril a junho e setembro a outubro",
      "cities": [
        {"name": "Paris", "summary": "Arte, moda, gastronomia e arquitetura em uma das capitais mais visitadas do mundo.", "attractions": ["Museu do Louvre", "Musée d'Orsay", "Torre Eiffel", "Palais Garnier", "Musée de l'Orangerie", "Jardins de Luxemburgo", "Sainte-Chapelle", "Le Marais"], "premium_experiences": ["Acesso privado a museus", "Cruzeiro privativo no Sena", "Alta gastronomia", "Compras com personal shopper"]},
        {"name": "Nice", "summary": "Porta de entrada da Riviera Francesa, combinando mar, arte e elegância mediterrânea.", "attractions": ["Promenade des Anglais", "Vieux Nice", "Musée Matisse", "Musée Marc Chagall", "Colline du Château", "Cours Saleya"], "premium_experiences": ["Passeio de iate", "Roteiro Riviera com motorista", "Beach clubs", "Experiência gastronômica provençal"]}
      ]
    },
    {
      "country": "Estados Unidos",
      "currency": "Dólar americano (USD)",
      "languages": ["Inglês"],
      "voltage": "120 V",
      "best_time": "Conforme a região; primavera e outono são amplamente favoráveis",
      "cities": [
        {"name": "Nova York", "summary": "Cultura, negócios, gastronomia, entretenimento e compras em escala global.", "attractions": ["Metropolitan Museum of Art", "MoMA", "Central Park", "High Line", "Broadway", "Rockefeller Center", "One World Observatory", "Brooklyn Bridge"], "premium_experiences": ["Ingressos premium para Broadway", "Tour de arte privativo", "Helicóptero panorâmico", "Concierge de compras e restaurantes"]},
        {"name": "Miami", "summary": "Praias, design, arte contemporânea, gastronomia e conexão com o Caribe e a América Latina.", "attractions": ["South Beach", "Art Deco Historic District", "Pérez Art Museum Miami", "Wynwood Walls", "Design District", "Vizcaya Museum and Gardens", "Key Biscayne"], "premium_experiences": ["Iate privativo", "Beach club", "Personal shopper", "Roteiro de arte e design"]}
      ]
    },
    {
      "country": "Japão",
      "currency": "Iene japonês (JPY)",
      "languages": ["Japonês"],
      "voltage": "100 V",
      "best_time": "Março a maio e outubro a novembro",
      "cities": [
        {"name": "Tóquio", "summary": "Tecnologia, tradição, design, gastronomia e hospitalidade japonesa.", "attractions": ["Senso-ji", "Meiji Jingu", "Tokyo National Museum", "Mori Art Museum", "teamLab", "Ginza", "Shibuya", "Shinjuku Gyoen"], "premium_experiences": ["Omakase privativo", "Ateliês de artes tradicionais", "Personal shopper em Ginza", "Cerimônia do chá"]},
        {"name": "Kyoto", "summary": "Templos, jardins, tradições e estética japonesa preservada.", "attractions": ["Kiyomizu-dera", "Fushimi Inari Taisha", "Kinkaku-ji", "Ginkaku-ji", "Nijo Castle", "Arashiyama", "Gion", "Kyoto National Museum"], "premium_experiences": ["Experiência cultural privativa", "Jantar kaiseki", "Cerimônia do chá", "Hospedagem em ryokan"]}
      ]
    },
    {
      "country": "África do Sul",
      "currency": "Rand sul-africano (ZAR)",
      "languages": ["11 idiomas oficiais"],
      "voltage": "230 V",
      "best_time": "Maio a setembro para safáris; novembro a março para o Cabo",
      "cities": [
        {"name": "Cidade do Cabo", "summary": "Montanhas, oceano, vinhos, design e gastronomia.", "attractions": ["Table Mountain", "V&A Waterfront", "Zeitz MOCAA", "Kirstenbosch", "Robben Island", "Cape Point", "Boulders Beach"], "premium_experiences": ["Helicóptero panorâmico", "Vinícolas privativas", "Iate ao pôr do sol", "Rota gastronômica"]},
        {"name": "Joanesburgo", "summary": "História contemporânea, arte, negócios e conexão com reservas de safári.", "attractions": ["Apartheid Museum", "Constitution Hill", "Johannesburg Art Gallery", "Maboneng", "Soweto", "Cradle of Humankind"], "premium_experiences": ["Tour histórico privativo", "Galerias e arte africana", "Conexão aérea para lodges", "Concierge executivo"]}
      ]
    },
    {
      "country": "Luxemburgo",
      "currency": "Euro (EUR)",
      "languages": ["Luxemburguês", "Francês", "Alemão"],
      "voltage": "230 V",
      "best_time": "Abril a outubro",
      "cities": [
        {"name": "Luxemburgo", "summary": "Centro financeiro europeu com patrimônio histórico, natureza e excelente conectividade regional.", "attractions": ["Casemates du Bock", "Palais Grand-Ducal", "Mudam Luxembourg", "Nationalmusée um Fëschmaart", "Chemin de la Corniche", "Parc Municipal", "Philharmonie Luxembourg"], "premium_experiences": ["Roteiro privado de patrimônio e arquitetura", "Gastronomia europeia", "Excursões ao Mosela", "Serviço executivo para viajantes de negócios"]},
        {"name": "Mosela Luxemburguesa", "summary": "Vinhos, paisagens fluviais e pequenas cidades elegantes próximas à capital.", "attractions": ["Remich", "Schengen", "Vinícolas do Mosela", "Passeios fluviais", "Trilhas e mirantes"], "premium_experiences": ["Degustação privativa", "Motorista executivo", "Almoço harmonizado", "Experiência trinacional"]}
      ]
    }
  ]
}
